,reviews
613," |  This trip has been awful. I am a college student and have summer classes I am traveling to. I booked my flight so that I would have enough time to get to my lodging location and finish a little homework before going to bed. When I arrived for my connecting I found out that my flight was canceled and I was not able to change the ""rebooked"" flight they had given me. The only reason they gave me for canceling the flight is the weather. There is no weather at my connection point or my destination. There is no weather between.  They would not give me a voucher for food or a hotel stating they don't do that for weather delays. I am now stuck at my connecting point for 8 hours waiting for the next flight to the destination. The airport I am stuck at does not have wifi and I have to use my hotspot that costs me money. Southwest would not let me change my destination, cancel with a refund, or change flight providers. When talking with the ticketing agent she also told me there is a high possibility that the ""rebooked"" flight will be canceled too. That means I will be at the airport until tomorrow with no voucher for a hotel, food, or wifi to do my homework. Southwest has used the ""WEATHER"" as an excuse so they don't have to give vouchers. There is no weather so don't say the cancelation is due to weather. They need to own up to the real issue. I am extremely fed up and will not be flying with them again if I have a choice."
639," | I used to love Southwest! Man, have they gone downhill. Let me preface my review that the pilots were amazing. Most of the stewards/stewardesses were obnoxious. They make every excuse to not provide food and beverage services. Checking in was an absolute nightmare! There was one staff member trying to direct hundreds of people, and he had no idea what he was doing! We arrived two hours early on our return flight and almost missed it because checking baggage was so disorganized! Will find another airline and hope they are better. One steward made the comment, ""It's time for us to get back to making money. The flight is full so don't protect seats."" Seriously?! There's a better way to convey that info! All of our flights were late, the second one by nearly two hours. My brand new luggage received a big ding to boot! Inexcusable!"
671,"  Absolutely horrible experience, I've flown 5 times since covid and you are the absolute worst. Flight was delayed 5 hours, and not once did we see anyone cleaning. There was no order to calling seats, section A was called but some B and C were allowed through at any time for no special reason other than getting in line before their turn and I use the word 'line' loosely, more like a cluster stampede. Masks were not enforced, people coughing unmasked. Tray on the back of the seat had sticky juicy all over it and the seat next to me, trash in pouch, obviously no cleaning. We were served open plastic cups that were carried on a tray down the isle that anyone not wearing their mask/ wearing it below their nose were breathing all over. Unboarding customers from the back were rude, unbuckled before we even stopped and then jumping to the front of the plane, instead of waiting your turn like it's always been. Stewards should be enforcing order from chaos. Plane was jam packed, no space in-between seats, strangers sitting right next to you taking off their masks to eat and drink. Keep in mind this also is a plane leaving Miami, Florida, 3rd highest covid state in the whole US."
700," | At the point of boarding the plane, I was verbally accosted by the gate agent who rudely embarrassed me by loudly stating I had too many carry on items to board the plane and that I needed to ""go over there and check something."" I politely tried to tell the woman that I had a bag with food for the flight and a fleece jacket in it. Didn't matter. I was accused of having a fanny pack when I was wearing a waist belt in lieu of carrying a purse. I had a mini backpack with chargers that per Southwest, are not supposed to be checked in baggage and a small suitcase. I was not given an opportunity to combine anything. I do not consider a waist belt, which I was wearing and is similar to a money belt or passport belt, to be a carry on item. It takes up no more space on my body than a belt on my pants. I never remove the waist belt and it does not impede sitting in a single seat or fastening my seatbelt. I do not consider food that I was going to eat in flight, especially as I was taking an antibiotic at that time for a GI condition, to be a carry on item. There were many, many other passengers who were carrying food on the plane in addition to other carry on items. I have never heard of a coat/jacket being considered as a carry on item. When I left Phoenix it was almost 90 degrees. When I arrived in Detroit 4 hours later, the temperature was about 45. To say a jacket/coat was necessary is an understatement. The gate agent was incredibly and unnecessarily rude. I was embarrassed unnecessarily in front of other passengers waiting to board. I have GI issues and cannot eat anything that might have been served in flight. Taking my own food on a 4 hour flight did not seem unreasonable. The mini backpack I had is about the size of an ordinary shoe box. Had I been given the chance, I would have combined items (except the waist belt) but I was denied that opportunity. I submitted a complaint to Southwest post-flight and received an email that in essence, blamed me for having so many carry on items, quoted a number of Southwest policies on baggage as if I do not know how to read and more importantly, failed to provide what I consider to be a sincere apology or any language about the gate agent receiving any kind of coaching, reprimand or training to correct her inappropriate behavior. In other words, it was all my fault. I am not ok with that. I have flown Southwest many times in the past and never had this kind of experience. I hope to never fly Southwest again. Public humiliation is uncalled for, period. Not being given a chance to ""fix"" my ""mistake"" and being ordered around rudely and loudly like a bad child is uncalled for. And to make matters worse, after we boarded the plane, we then sat in line with 24 planes ahead of us and took off 30 minutes late. Wow."
710,"  Last week, my husband and I flew Southwest to Orlando. Flight was good until the end. The flight attendant had the supervisors call the cops on us. There was 4 cops & 2 supervisors waiting for us in the gate when you walk off the plane. Obviously face masks are required during the flight, unless you were eating or drinking. During the flight, my husband fell asleep and I put my earbuds in and started drawing. He slept with a neck pillow and his face mask would catch on the pillow and slightly fall lower than his nose. The flight attendant woke him up a couple times and asked him to pull it back up. He apologized and went back to sleep. As far me, I went into my purse to grab 2 mints and a protein bar. I pulled my face mask down to put the mint in my mouth. The flight attendant snapped and told me to put my mask back on, I said I was eating. She said, “it’s only a mint and if this is going to be an issue, I’ll call the supervisor!” And stormed off. We land and get off the plane only to be greeted by the cops. The cops questioned us on what happened on the flight. The cop told us that face to face conflict/confrontation was reported from the flight attendant and that’s why they were called. The supervisor looked up our return flight and revoked them. All over sleeping and eating a mint. The flight attendant might have had a bad day but it’s not enough justification to go out of your way to wreck our trip. Her behavior is unacceptable. I understand you want to keep everyone safe. But you’re taking it too far. Not once did we raise our voice, or stand up and cause issues. Revoking our tickets over something this small, is unbelievable. If it’s that big of deal to eat on the flight, then stop serving water and snacks. Southwest, I want to truly thank you from the bottom of my heart for blowing things out of context and wrecking our trip. We cannot thank you enough for your unbelievable customer service."
720," |  The absolute worst experience! I have flown with SW about 12 times since the COVID disrupted our world. This day was humiliating to say the least! Once onboard I had my face mask on as requested. I had lowered the mask below my nose while my mouth was still covered to take a couple of deep breaths before take off. The female flight attendant was walking past and immediately reprimanded me. I quietly tried to explain what I was doing. Her response was that of a nazi ruler saying this wasn’t acceptable. During the 30’ flight it was time to take my prescription so I ate a snack so I wouldn’t take the medicine on an empty stomach and then took a drink of water. The entire time the attendant was just staring me down. Once we arrived HOU and I stepped off the plane the neo-nazi was standing there and pointed me out to her manager. They then said obviously my health needs wouldn’t be acceptable to fly with them and denied me to make my connecting flight, leaving me stranded 1300 miles from home!"
766,"  Chicago Midway to Denver. Adding my disappointment in what has been known as the airlines that have the best customer service and ""caring"" for their customers. I would expect them to take the lead on understanding and how they can help customers in these scary and challenging times. I also had an event canceled due to Coronavirus and it will not be rescheduled. So I will not be refunded. Or I can use this money for a year for something else, I guess I just pick a place to go to use the money, then also will have hotel and food fees, etc? we are not a family that can afford to just go somewhere to use this. Maybe something will come up that we have to go to in a year, who knows. But this has changed totally how I feel about Southwest Airlines and I will not choose them in the future.  American airlines refunded my friend for a cancellation due to Coronavirus. Wrong move Southwest, wrong move."
777," |  Horrible Customer Service. My husband and I went to Jamaica out of Tampa. Upon our return flight our flight was delayed for over 8 hours. We were given vouchers for food at the airport, flight credit and a hotel stay. We were told they will provide transportation to the hotel since we were getting back late. Long story short there were over 100 people waiting for transportation and they only sent 1 van for a total of 12 passengers. Southwest left us stranded at the hotel, we filed a complaint, was told wrong department and never got a follow up. This company just takes your money, gives false information and points the finger at everyone else and don't care about their customers. I would not recommend them to anyone."
791, |  Baltimore to Boston. Purchased a drink on flight. Should never have served the drink because they only gave us 5 minutes to drink it! Was told the receipt would be available online. It was not available on 2/12. Tried again today: entered confirmation code and flight dates and no receipt was found! Waited 20 minutes for a call back from SW (promised less than 15). First tier told me nothing could be done until Monday morning. Asked to speak to a manager. She said she could look it up on southwest.com. Why didn't the first tier offer that? She is still looking while I type this review.
812," | Houston to Denver via Dallas. I've even had better luck flying on United, and that's saying a lot considering United's abysmal reputation! To begin with my stories - Most recent flight, October 2019, Denver back to Houston: Unremarkable flight. Southwest check-in agent in Denver who collected my checked baggage was ""mechanically"" professional but lacked much in the way of personality. Upon arrival at Houston, baggage was oh, so slow to come out! Second most recent flight, October 2019, Houston via Dallas to Denver: Southwest check-in agent in Houston who collected my checked baggage was ""mechanically"" professional, again. Gate agents in both Houston and Dallas acted quite bored, honestly. I didn't notice the splotches of dried drink, food chunks and blood (yes, that is correct, blood) surrounding my seat until I sat down, and I had to sit down because I was one of the last people to board the plane. I sent Southwest a scathing review of that flight and got a $75 credit for a future flight for what it's worth. Third most recent flight, May 2019, Austin to Albuquerque then back to Austin: Any Southwest staff I interacted with at either airport couldn't be paid enough, it seems, to even bother to pleasantly interact with staff. That said, I remember the pilot on the first leg, from Austin to Albuquerque, trying to engage the passengers, so good for him! Fourth most recent flight, October 2018, Dallas to Louisville: The man who checked in my baggage at the curb barely said a word or even grunted, and even fairly forcefully threw said baggage onto the carousel even after I had told him that I have fragile items within! No ""thank you,"" no ""this is your ticket and go this way to your gate,"" nothing! Southwest's overall concept of customer service has plummeted over the last decade, and, after October 2019, I'll absolutely no longer fly them unless they are significantly cheaper than any competitor."
867,"  Las Vegas to Columbus. The Male flight attendant had a favorite row. He spent half the flight standing and talking to them. By the time we got out drinks our ""snacks"" (fritos and baby cookies) were gone because he was so busy playing favorites. Very unprofessional when I spent over 1000 dollars flying with you guys this trip. Never again."
892,"  Dallas to Denver. The staff taking drinks to people was nice, but I watched him talk to co-workers while people are looking around at least twice. $300 each way so $600 is a waste if you don’t have beverages."
903," |  Reno to Phoenix.  I would say Southwest is unreliable in terms of timing, especially out of Reno. Sometimes they are on time, but I can say without hesitation, there are other airlines who are more reliable in terms of timing. Also Southwest aircraft are not the cleanest (food on floor, dirt between seats, etc). That said, they are cheap, flexible, easy changes, good bag allowance, good staff. But timing is not their thing."
910," |  Absolutely ridiculous customer service. Don’t fly Southwest Airlines. Remember, you get what you pay for. If there are any issues that would require customer service assistance from this airline your done for. The nightmare initially begun on the 17th of July when I was scheduled to depart from St. Louis to arrive in Norfolk, VA. Arrive at the Southwest ticketing counter to learn my flight had been cancelled due to weather. Once I learned this, I asked the ticketing agent isn’t it protocol for someone to call, text, or email me the customer, to make them aware of the flight changes. The reply I got was priceless. Basically, my question was ignored. So, now the ticketing agent begins to look in order to rebook my flight. Now, they book me a flight for the very next morning. However, this time I will have to fly from St Louis to Cleveland, OH, then to Chicago, Illinois and then onto a Norfolk. Of course, I accept the reservation thinking all has been resolved and there would be no more issues. So approximately hours later I arrive back in St. Louis airport. I board the first flight from St. Louis thinking I’m finally on my way to my destination and I would be good to go. The plane lands arriving in Cleveland with the pilot coming on the speaker stating, “there’s a weather delay and no one can get in or out of Chicago”!  After sitting in Cleveland for almost four hours until finally being cleared for take off to continue the journey now to Chicago and then Norfolk. Finally, land in Chicago approximately three hours after my Southwest connection flight had already departed for Norfolk. I immediately go to Southwest customer service counter to explain what I just went through. First, I’m told all remaining flights are booked going to Norfolk. I’m also told that they can fly me to Baltimore, Maryland the next day, which would be the third day! And I’m also told when I get to Baltimore I would have to be on standby in order to try to get a flight to Norfolk. Now, my frustration is beginning to show. I ask if I would be provided a hotel here in Chicago and I was told no. So, I get no hotel, no later flight, and absolutely nothing at all in order to make up for this inconvenience. Not even a bag of peanuts or even a drink. I always knew this was a suspect airline. However, take it from me. Save your money and go United or Delta. If you don’t and something happens. In my case weather!!! Then, your just throwing your money away. I understand weather is not the airlines fault. However, it’s how the customer service takes care of their customers during that inconvenience is what is being measured. I’m a customer who definitely learns from their mistakes. In short, no one should have to experience this, especially in a strange unfamiliar city and then get told that the best they can do is have me sleep on the floor in the airport and then ride to another strange city to then be placed on standby for the final destination"
913,  Atlanta to Las Vegas. I would never fly with this airline ever. First the flight pattern was changed. Just as we were getting ready to board the took our plane and sent it to Ft Lauderdale. Then we had to wait for them to locate us a plane. Now I paid for a direct flight. We had to first go to St Louis at which point we were not to change planes. We were taxiing in to unload those not going on with us and we were told to change planes. Then we had to go to Austin prior to Vegas. Now they only offered us food in a snack pack of mini pretzels (child size snack pack). While waiting in Austin to board additional people. The staff were begging no one to open window shades as the A/C was not working properly. It was over booked and very hot. 8 hrs later we land in Las Vegas starving and tired and hot. This airline could careless about our first experience with them
954," |  We had a flight from San Antonio to Colorado to Vegas for Thursday at 7:45pm we had a wedding to get too. Our flight got delayed so we wouldn’t be flying out till 11:30. We sat at the airport all night for a few hours and then They offered all of the passengers $100 vouchers. As we went to get our $100 vouchers they said our flight was canceled it would be too late for us to leave from Colorado to Vegas when it landed so they said they Can re book us. They rebooked us to fly out of San Antonio BUT they split us up and we all are having to arrive at separate times ranges from early morning to late afternoon. We lost a night of a hotel we had already paid for because the hotel wouldn’t let us save our night for another one. We missed the wedding we were going for and one of our friends was stuck without a hotel since we wouldn’t get there till the next day to check In for her since it was underneath one of our names. Very disappointed they did a horrible job in accommodating us for the horrible experience we had. The lady said it’s out of her hands and we can either re book or leave it alone. Southwest Airlines has done nothing to make us feel like we didn’t lose out on time, hotel money and food and our friend was left stranded alone in the Vegas airport for a whole night."
985," | Grand Rapids to Las Vegas. Very disappointed. First, they cancelled my flight 3 days before leaving. They informed me by automated call that it was cancelled but, I could have my money back. No offer of alternate flights, nothing and, I went through a travel agent! They hung up when we tried to book other flights. Offered nothing in return of losing most of a vacation day. Then, coming home more delays and a “sorry” over the speaker at the airport. How about a ticket, discount, drinks, premium seating? Nothing. Southwest needs to work on customer service!"
999," |  I had a change of last name that I e-mailed well back in Jan 2019. Upon requesting how to get my last name change, I was not informed that I should also include any upcoming flight reservation numbers. That being said, only my Rapid Rewards profile was updated on the site, nothing else. I didn't know what to make of this by the time I went to fly out. I was allowed to fly with my old married last name with no issues, but was almost left to not be allowed to get on the plane from Austin because my ID didn't match my boarding pass name. This caused me to nearly miss my flight and I rushed to the gate losing 4 items!  I've never in my life lost so many items in my life- especially not all at once! I was incredibly flustered. I lost 2 items at Austin, one on a plane going to Nashville, then at the Nashville Airport before boarding my flight back to Chicago. The incorrect last name was Baker instead of Anderson. I called to their Customer Service headquarters to where the best they could do was offer me a voucher of $100. That's not even enough for a free flight (round trip) to anywhere! They seriously don't care about their customers because aside from using this voucher, I will no longer be using their flight services again. I didn't even get a promised drink from Nashville into Chicago. I also landed without a jacket (because this was one of my 4 lost items) and ended up freezing. I've reported my lost items twice! TWICE! Because after you call in to report a claim of a lost item, they insist that you fill out a document of theirs to be submitted via e-mail on top of it. This company makes all sorts of excuses as to why they won't do anything further. They say that they had no idea I had an upcoming flight based on my RR#. I had no idea they even needed it! So, they can't point blame on me. What happened to the ""Customer's always right!"" attitude? I'll be taking my business elsewhere and I recommend everyone else does the same! I get that they are not responsible for lost items; however, I would not have lost any of those items if I hadn't been flustered to missing my plane to begin with- so yes, it is their fault when I've never lost anything at airports in my life! I'm very disappointed in this airline company and I cannot wait to use their voucher to just move on to another airline company."
